{
  "id": "keeping-the-books",
  "name": "keeping the books",
  "authority": "emsenn",
  "work": "keeping-the-books",
  "claim": "emsenn",
  "skills": [
    "keeping-the-books"
  ],
  "delegation": false,
  "x-provenance": {
    "recorded-by": "claude/requirements-implementation-team",
    "recorded-on": "2026-07-16",
    "derived-from": "emsenn/requirement/the-firm-carries-its-corporate-functions"
  }
}
