{
  "id": "auditing-the-firms-registers",
  "name": "auditing the firm's registers",
  "authority": "emsenn",
  "work": "auditing-the-firms-registers",
  "claim": "emsenn",
  "skills": [
    "auditing-the-firms-registers"
  ],
  "delegation": false,
  "x-provenance": {
    "recorded-by": "claude/requirements-implementation-team",
    "recorded-on": "2026-07-16",
    "derived-from": "emsenn/requirement/the-firm-carries-its-corporate-functions"
  }
}
